样本ID,G1,G2,G3,L1,L2,L3,R1,R2,R3,C1,C2,C3,C4,C5,OT,NS,判断依据,标签汇总,一级分类,二级分类,三级分类,界面标签,最终标签,title,content,alltext,time_series,post_id
0,0,0,0,0,0,0,0,0,0,0,0,0,0,0,0,1,文本描述了反诈人士收到的移除通知，但没有具体描述诈骗行为和受害者操作细节。,NS,其他,信息不足,,无,其他 - 信息不足 [界面:无],,寄语义务反诈人士们：虽然在年，系统所处理的<盗图假号移除通知>不尽人意；至少还是收到一些零零碎碎的<移除通知>也算是给予积极反诈人士们的一些精神补偿吧...... 年的系统操作方式，好像又是在"开倒车"了???因为曾经"列队进来"的移除通知似乎已成为历史矣......在加上最近频频收到莫名其妙的<假移除通知>；即被系统移除后的鬼号，依然还打得开哦到底目前系统的<移除通知>可信度有多高呢???这是在年 1 月份的前两个星期，系统赐予反诈人士们的寥寥无几<移除通知安慰奖>......年，所收到的第至个被<FB 系统>移除的鬼号通知!!!<FB 系统>移除鬼号通知的时间段：3 Jan 2026@12.06am 至 13 Jan 2026@7.47am~~~~~~~~~~~~~~~~~~~~~~~~~~~~~~~~~~~1. Zhong Hui (3 Jan 2026@12.06am)2. Zhenxi Dangxia (3 Jan 2026@12.27am)(检举自唐果版主<已闹失踪???>的举发文；即全部贴文不见了!!!)3. 林曉珠 (3 Jan 2026@12.35am)4. 陳達東 (3 Jan 2026@2.23am)5. Anna Plana (3 Jan 2026@2.25am)6. Rou Sio Sha (3 Jan 2026@2.30am)7. 高晧誌 (3 Jan 2026@2.32am)8. Kevin Lee (3 Jan 2026@2.45am)9. 专业受理欺诈案件 (5 Jan 2026@11.27am)(检举自<买一送一>的二诈假账号 B)10. 李曉燕 (5 Jan 2026@11.39am)(检举自唐果版主<已闹失踪???>的举发文；即全部贴文不见了!!!)11. 李文豪 (7 Jan 2026@2.56am)12a. Hongming Peng(7 Jan 2026@5.57pm)(第一次被系统移除后，竟然再度现身的鬼号???)12b. Hongming Peng(14 Jan 2026@12.07am)(再次检举后，莫名其妙的系统又再来第二次移除通知???)13. Kazuhiko Sugioka(9 Jan 2026@11.39pm)14. Hsin Yu Hsieh (10 Jan 2026@4.41am)15. Karl Maloney/林冠宇(10 Jan 2026@4.44am)(拥有两个鬼名的假账号)16. 陳清泉 (10 Jan 2026@4.47am)(检举自另一个反诈社团的鬼号)17. 王清遠 (10 Jan 2026@4.50am)18. 陳偉霖 (10 Jan 2026@12.49pm)(检举自唐果版主<已闹失踪???>的举发文；即全部贴文不见了!!!)19. Woo Kim (10 Jan 2026@12.56pm)20. Jie傑 (11 Jan 2026@10.13am)(检举自另一个反诈社团的鬼号)21. Micheal Le/Charlotte Lim(12 Jan 2026@1.11am)(拥有两个鬼名的假账号)22. Elliot Guo (12 Jan 2026@9.57am)23. 张秀希 (12 Jan 2026@10.09am)(检举自<反诈网友>所提供的鬼号)24. Lu Cas (13 Jan 2026@7.47am)(检举自另一个反诈社团的鬼号)衷心祈求这 24 只被 FB 系统移除的<盗图骗子们>万劫不复矣；一路走好......拜托别再回头!!!,寄语义务反诈人士们：虽然在年，系统所处理的<盗图假号移除通知>不尽人意；至少还是收到一些零零碎碎的<移除通知>也算是给予积极反诈人士们的一些精神补偿吧...... 年的系统操作方式，好像又是在"开倒车"了???因为曾经"列队进来"的移除通知似乎已成为历史矣......在加上最近频频收到莫名其妙的<假移除通知>；即被系统移除后的鬼号，依然还打得开哦到底目前系统的<移除通知>可信度有多高呢???这是在年 1 月份的前两个星期，系统赐予反诈人士们的寥寥无几<移除通知安慰奖>......年，所收到的第至个被<FB 系统>移除的鬼号通知!!!<FB 系统>移除鬼号通知的时间段：3 Jan 2026@12.06am 至 13 Jan 2026@7.47am~~~~~~~~~~~~~~~~~~~~~~~~~~~~~~~~~~~1. Zhong Hui (3 Jan 2026@12.06am)2. Zhenxi Dangxia (3 Jan 2026@12.27am)(检举自唐果版主<已闹失踪???>的举发文；即全部贴文不见了!!!)3. 林曉珠 (3 Jan 2026@12.35am)4. 陳達東 (3 Jan 2026@2.23am)5. Anna Plana (3 Jan 2026@2.25am)6. Rou Sio Sha (3 Jan 2026@2.30am)7. 高晧誌 (3 Jan 2026@2.32am)8. Kevin Lee (3 Jan 2026@2.45am)9. 专业受理欺诈案件 (5 Jan 2026@11.27am)(检举自<买一送一>的二诈假账号 B)10. 李曉燕 (5 Jan 2026@11.39am)(检举自唐果版主<已闹失踪???>的举发文；即全部贴文不见了!!!)11. 李文豪 (7 Jan 2026@2.56am)12a. Hongming Peng(7 Jan 2026@5.57pm)(第一次被系统移除后，竟然再度现身的鬼号???)12b. Hongming Peng(14 Jan 2026@12.07am)(再次检举后，莫名其妙的系统又再来第二次移除通知???)13. Kazuhiko Sugioka(9 Jan 2026@11.39pm)14. Hsin Yu Hsieh (10 Jan 2026@4.41am)15. Karl Maloney/林冠宇(10 Jan 2026@4.44am)(拥有两个鬼名的假账号)16. 陳清泉 (10 Jan 2026@4.47am)(检举自另一个反诈社团的鬼号)17. 王清遠 (10 Jan 2026@4.50am)18. 陳偉霖 (10 Jan 2026@12.49pm)(检举自唐果版主<已闹失踪???>的举发文；即全部贴文不见了!!!)19. Woo Kim (10 Jan 2026@12.56pm)20. Jie傑 (11 Jan 2026@10.13am)(检举自另一个反诈社团的鬼号)21. Micheal Le/Charlotte Lim(12 Jan 2026@1.11am)(拥有两个鬼名的假账号)22. Elliot Guo (12 Jan 2026@9.57am)23. 张秀希 (12 Jan 2026@10.09am)(检举自<反诈网友>所提供的鬼号)24. Lu Cas (13 Jan 2026@7.47am)(检举自另一个反诈社团的鬼号)衷心祈求这 24 只被 FB 系统移除的<盗图骗子们>万劫不复矣；一路走好......拜托别再回头!!!,#N/A,FACEBOOK_20260118040020188_01e6d218
1,0,0,0,0,0,0,0,0,0,0,0,0,0,0,0,1,该文本描述了家人被诈骗的情况，但未提供具体的诈骗手法和细节。,NS,其他,信息不足,,无,其他 - 信息不足 [界面:无],,高中時期有半工半讀賺點零用錢，家人也千交代萬交代叫我存起來我不要去動，他也不會去動，我也都沒動，後來發現他被詐騙了，他也動我高中存的那些錢，我現在完全不知道怎麼面對他，不知道怎麼信任自己的家人，有人知道怎麼辦嗎？,高中時期有半工半讀賺點零用錢，家人也千交代萬交代叫我存起來我不要去動，他也不會去動，我也都沒動，後來發現他被詐騙了，他也動我高中存的那些錢，我現在完全不知道怎麼面對他，不知道怎麼信任自己的家人，有人知道怎麼辦嗎？,#N/A,FACEBOOK_20251102143459354_2c6ab99c
2,0,0,0,0,0,0,0,0,0,0,0,0,0,0,0,0,该文本为一个链接，没有描述任何诈骗行为。,无1标记,其他,非诈骗,,无,其他 - 非诈骗 [界面:无],,https://secure.avaaz.org/community_petitions/en/sheng_yuan_yu_meng_long_de_suo_you_shan_liang_ren__justice_for_yu_menglong_alan_yu_wei_yu_meng_long_tao_gong_dao/?__HASH__=&utm_source=copy&utm_medium=social_share&utm_campaign=1748244&utm_term=__HASH__%2Ben&share_location=do_postaction&astro=true,https://secure.avaaz.org/community_petitions/en/sheng_yuan_yu_meng_long_de_suo_you_shan_liang_ren__justice_for_yu_menglong_alan_yu_wei_yu_meng_long_tao_gong_dao/?__HASH__=&utm_source=copy&utm_medium=social_share&utm_campaign=1748244&utm_term=__HASH__%2Ben&share_location=do_postaction&astro=true,#N/A,FACEBOOK_20251102143500097_8d7fc01e
3,0,0,0,0,0,0,0,0,0,0,0,0,0,0,0,0,文本中没有描述具体的诈骗行为，也没有提供足够的信息来判断是否存在诈骗。,无1标记,其他,非诈骗,,无,其他 - 非诈骗 [界面:无],,請問這個是詐騙嗎？謝謝,請問這個是詐騙嗎？謝謝,#N/A,FACEBOOK_20251102143500498_456e22bc
4,0,0,0,0,0,0,0,0,0,0,0,0,0,0,0,0,该文本没有描述任何诈骗行为。,无1标记,其他,非诈骗,,无,其他 - 非诈骗 [界面:无],,幹嘛遣送回來？,幹嘛遣送回來？,#N/A,FACEBOOK_20251102143500886_97ad8cbe
5,0,0,0,0,0,0,0,0,0,0,0,0,0,0,0,0,该文本未描述具体的诈骗行为及手法，仅提及了一起考试造假事件。,无1标记,其他,非诈骗,,无,其他 - 非诈骗 [界面:无],"【IELTS騙局】80,000考生造假 騙取英國簽證 | LIHKG",,"【IELTS騙局】80,000考生造假 騙取英國簽證 | LIHKG",#N/A,LK_20251213040009657_c3402e06
6,0,0,0,0,0,0,0,0,0,0,0,0,0,0,0,0,该文本未描述任何诈骗行为。,无1标记,其他,非诈骗,,无,其他 - 非诈骗 [界面:无],政府飲用水｜鑫鼎鑫曾交水質測試證明 檢定中心董事林健鋒：從未進行 批用「假報告」騙合約 | LIHKG,超哥計起幾歲都冇未戒奶，包容吓！！,政府飲用水｜鑫鼎鑫曾交水質測試證明 檢定中心董事林健鋒：從未進行 批用「假報告」騙合約 | LIHKG超哥計起幾歲都冇未戒奶，包容吓！！,#N/A,LK_20251105102938213_42d7afa9
7,1,1,0,0,0,0,0,0,0,0,0,0,0,0,0,0,文本描述了诈骗者通过新建立的关系承诺获利，并诱导受害者将资金存入非法加密货币平台。,G1+G2,有叙事诈骗,G,G1+G2,无,有叙事诈骗 - G - G1+G2 [界面:无],Why does meta allows crypto scammers to display ads to lure victims?,"A close person to me fell into what we call ""pig butchering"" , a scam where the scammer bonds with the victim slowly gaining their confidence and then leading them to deposit their money into unlegitimate crypto platform. I started learning about that started having reels on instagram from supposedly rich crypto trader exposing their rich lifestyle and that you can just copy paste their trade to become rich yourself. There was tons of these ads as I started watching them and sometimes even leaving a comment on the reels purposely. Now my question is why does meta do nothing to stop these ads and protect potential victims in the future?","Why does meta allows crypto scammers to display ads to lure victims?A close person to me fell into what we call ""pig butchering"" , a scam where the scammer bonds with the victim slowly gaining their confidence and then leading them to deposit their money into unlegitimate crypto platform. I started learning about that started having reels on instagram from supposedly rich crypto trader exposing their rich lifestyle and that you can just copy paste their trade to become rich yourself. There was tons of these ads as I started watching them and sometimes even leaving a comment on the reels purposely. Now my question is why does meta do nothing to stop these ads and protect potential victims in the future?",["G2 & G1"],reddit_1764437518_1p9unca
8,0,0,0,0,0,0,0,0,0,0,0,0,0,0,0,1,文本描述了诈骗行为，但没有具体手法描述和受害者操作细节。,NS,其他,信息不足,,无,其他 - 信息不足 [界面:无],英美制裁柬埔寨犯罪集團　涉與最少10個詐騙園區有關　福建出生主腦持有香港兩上市公司 | LIHKG,"美國和英國政府昨日（14日）公佈採取聯合行動，制裁柬埔寨犯罪集團主腦陳志及與其相關的100多間公司，最少19項物業被凍結、價值約150億美元（約1,166億港元）的比特幣被美國沒收。美國財政部指陳志成立的企業營運最少10個詐騙園區，從事網上情緣、賭場及加密幣騙局等活動，過程涉及人口販運、強迫勞動以至性剝削。英美兩國公開資料顯示，陳志的3個聯絡地址有兩處是位於香港的商廈，他在香港亦直接或間接控制10間公司，包括上市企業致浩達控股（1707）及坤集團（0924）。陳志1987年12月出生於中國福建省，英國財政部文件顯示他柬埔寨、瓦努阿圖和塞浦路斯國籍，但沒有中國籍。陳志2010年代於柬埔寨成立企業太子集團，於金邊、施漢諾市等地大舉投資地產及賭博等行業，同時於政界扶搖直上，2020年起擔任柬埔寨首相顧問。英國財政部文件顯示陳志的3個聯絡地址位於香港和柬埔寨首都金邊，其中香港的兩個地址分別為尖沙嘴金巴利道68號和中環長江中心。美國財政部則指陳志直接或間接控制89間公司，其中致浩達控股等10間公司在香港註冊。翻查資料，致浩達控股今年7月發通告，指陳志辭任董事會主席及執行董事。Channel WE 報料熱線 - WhatsApp 84898873👉https://api.whatsapp.com/send?phone=85284898873美國財政部指太子集團的利潤來自跨國犯罪，包括性剝削、洗黑錢、詐騙、貪污、非法網上賭博、人口販運、強迫勞動等，稱該企業涉及柬埔寨最少10個詐騙園區。當局續稱詐騙園區往往以高薪厚職招聘，但當勞工抵埗便會強迫他們從事網上情緣、投資騙局等活動，亦會沒收勞工的護照和虐待他們。美國充公1,166億元比特幣英國政府稱陳志及其同謀在倫敦持有最少19項物業，包括於倫敦金融區價值1億英鎊（約10.35億港元）的辦公室及倫敦市中心多個住宅單位，其中單在新牛津街的地標建築「Center Point」便擁有7個單位，這些物業已被凍結。美國司法部公佈就案件充公127,271枚比特幣，市值約150億美元（約1,166億港元），是歷來金額最大的充公行動。除了比特幣，陳志等人亦涉嫌以犯罪得益購買手錶、遊艇、私人飛機和藝術品等。美國政府已向法院提交文件起訴陳志，若罪成最高可被判監40年，目前正追緝他。陳志成立的另外兩間公司金貝集團（Jin Bei）和金運度假世界（Golden Fortune Resorts World）今年較早前被國際特赦組織點名，指它們於柬埔寨營運詐騙園區，且園區存在強迫勞動和酷刑。金貝集團、金運度假世界及與陳志有關的加密幣交易平台Byex Exchange亦被列入英國制裁名單。英國外相顧綺慧批評犯罪集團摧毀弱勢者的人生，更於倫敦購買物業以藏起其財富，期望藉今次制裁阻止黑錢流入市面。美國財長貝森特則稱跨國詐騙對美國公民構成數以十億計美元損失，不少人畢生積蓄轉眼間化為烏有，美國財政部會跟執法部門及外國政府合作保護美國國民。https://www.facebook.com/share/18hmQXtjdZ/?mibextid=wwXIfr國際詐騙洗錢中心又多個新朵但估唔到連誠哥中心都有收過詐騙來源收返黎的錢","英美制裁柬埔寨犯罪集團　涉與最少10個詐騙園區有關　福建出生主腦持有香港兩上市公司 | LIHKG美國和英國政府昨日（14日）公佈採取聯合行動，制裁柬埔寨犯罪集團主腦陳志及與其相關的100多間公司，最少19項物業被凍結、價值約150億美元（約1,166億港元）的比特幣被美國沒收。美國財政部指陳志成立的企業營運最少10個詐騙園區，從事網上情緣、賭場及加密幣騙局等活動，過程涉及人口販運、強迫勞動以至性剝削。英美兩國公開資料顯示，陳志的3個聯絡地址有兩處是位於香港的商廈，他在香港亦直接或間接控制10間公司，包括上市企業致浩達控股（1707）及坤集團（0924）。陳志1987年12月出生於中國福建省，英國財政部文件顯示他柬埔寨、瓦努阿圖和塞浦路斯國籍，但沒有中國籍。陳志2010年代於柬埔寨成立企業太子集團，於金邊、施漢諾市等地大舉投資地產及賭博等行業，同時於政界扶搖直上，2020年起擔任柬埔寨首相顧問。英國財政部文件顯示陳志的3個聯絡地址位於香港和柬埔寨首都金邊，其中香港的兩個地址分別為尖沙嘴金巴利道68號和中環長江中心。美國財政部則指陳志直接或間接控制89間公司，其中致浩達控股等10間公司在香港註冊。翻查資料，致浩達控股今年7月發通告，指陳志辭任董事會主席及執行董事。Channel WE 報料熱線 - WhatsApp 84898873👉https://api.whatsapp.com/send?phone=85284898873美國財政部指太子集團的利潤來自跨國犯罪，包括性剝削、洗黑錢、詐騙、貪污、非法網上賭博、人口販運、強迫勞動等，稱該企業涉及柬埔寨最少10個詐騙園區。當局續稱詐騙園區往往以高薪厚職招聘，但當勞工抵埗便會強迫他們從事網上情緣、投資騙局等活動，亦會沒收勞工的護照和虐待他們。美國充公1,166億元比特幣英國政府稱陳志及其同謀在倫敦持有最少19項物業，包括於倫敦金融區價值1億英鎊（約10.35億港元）的辦公室及倫敦市中心多個住宅單位，其中單在新牛津街的地標建築「Center Point」便擁有7個單位，這些物業已被凍結。美國司法部公佈就案件充公127,271枚比特幣，市值約150億美元（約1,166億港元），是歷來金額最大的充公行動。除了比特幣，陳志等人亦涉嫌以犯罪得益購買手錶、遊艇、私人飛機和藝術品等。美國政府已向法院提交文件起訴陳志，若罪成最高可被判監40年，目前正追緝他。陳志成立的另外兩間公司金貝集團（Jin Bei）和金運度假世界（Golden Fortune Resorts World）今年較早前被國際特赦組織點名，指它們於柬埔寨營運詐騙園區，且園區存在強迫勞動和酷刑。金貝集團、金運度假世界及與陳志有關的加密幣交易平台Byex Exchange亦被列入英國制裁名單。英國外相顧綺慧批評犯罪集團摧毀弱勢者的人生，更於倫敦購買物業以藏起其財富，期望藉今次制裁阻止黑錢流入市面。美國財長貝森特則稱跨國詐騙對美國公民構成數以十億計美元損失，不少人畢生積蓄轉眼間化為烏有，美國財政部會跟執法部門及外國政府合作保護美國國民。https://www.facebook.com/share/18hmQXtjdZ/?mibextid=wwXIfr國際詐騙洗錢中心又多個新朵但估唔到連誠哥中心都有收過詐騙來源收返黎的錢",#N/A,LK_20251105102944568_930b31a7
9,0,0,0,0,0,0,0,0,0,0,0,0,0,0,0,0,文本仅讨论台湾诈骗现象及他人受骗经历，未描述具体诈骗行为细节，不符合诈骗行为三要素。,无1标记,其他,非诈骗,,无,其他 - 非诈骗 [界面:无],認真討論點解台灣咁多詐騙比人詐騙去kk園區 | LIHKG,個鄰居為左省60元ntd運費連個銀行户口都比人凍結埋新聞又成日報班友比人呃去金邊我出關勁緊張問我去東南亞做乜（我本護照有蓋章係東南亞領事館拎）,認真討論點解台灣咁多詐騙比人詐騙去kk園區 | LIHKG個鄰居為左省60元ntd運費連個銀行户口都比人凍結埋新聞又成日報班友比人呃去金邊我出關勁緊張問我去東南亞做乜（我本護照有蓋章係東南亞領事館拎）,#N/A,LK_20251105102944934_710ea37f
